{
  "model_set_id": "hanbit-live-reliability",
  "model_set_version": "1.0.0",
  "updated_at": "2026-09-03T04:00:00Z",
  "models": {
    "cnc-failure-risk": {
      "model_version": "cnc-random-forest-v3-f898a33ade7f",
      "required": true
    },
    "compressor-failure-risk": {
      "model_version": "compressor-random-forest-v3-138e75c0f721",
      "required": true
    }
  }
}
